{
  "artifacts": {
    "apt_repository": {
      "filename": "iros2j-apt_trixie_arm64.tar.gz",
      "sha256": "44415440f02e0d77c2dad6ad8bff520c24918e6304e78028ea905ac58bbd60c7"
    },
    "install_smoke": {
      "filename": "install-smoke-test.txt",
      "sha256": "5a8434f0506aeb7fd9e2b70eaa599a273c30b0696495070c5b4ed737374fe718"
    },
    "native_gate": {
      "filename": "native-gate.json"
    },
    "sbom": {
      "filename": "iros2j-1.0.2.spdx.json",
      "sha256": "c9367c13ca01b48c3195615e5fe16ad681cfbcfe9ecbcadcb44fa878fd47af82"
    },
    "sha256": {
      "filename": "iros2j-apt_trixie_arm64.tar.gz.sha256",
      "sha256": "ad54f6aa7006c9ed11f224fab864b69b8aab7a7114c01f4d4aa8908869ae7f67"
    }
  },
  "build": {
    "architecture": "arm64",
    "build_type": "Release",
    "codename": "trixie",
    "install_prefix": "/opt/iros2j",
    "native": true,
    "operating_system": "debian",
    "release": "13"
  },
  "excluded": [
    "amd64",
    "docker",
    "qemu",
    "vins-neo-validation",
    "monolithic-packages"
  ],
  "packages": {
    "inventory_sha256": "9a13887d7fe5a7aaf59f048a2a4247fd3395e94a05158da5fca7355c2328119f",
    "namespace": "iros2j",
    "required_metapackages": [
      "iros2j-ros-core",
      "iros2j-ros-base",
      "iros2j-common-interfaces",
      "iros2j-vision-opencv",
      "iros2j-rviz2"
    ]
  },
  "provenance": {
    "build_commit": "b802638395478eea14248570670562f4ff49f714"
  },
  "release": {
    "debian_version": "1.0.2-1+deb13",
    "name": "iros2j",
    "package_version": "1.0.2",
    "process_version": "1.5.12",
    "status": "released",
    "tag": "v2.1.0.2"
  },
  "schema_version": 1,
  "sources": {
    "lock_file": "manifests/iros2j-jazzy.lock.repos",
    "lock_sha256": "99a65d1ba35707626bf2a33e6de43e64decba8f5f357bd6671704618b4faff45",
    "ros_distribution": "jazzy"
  }
}
